{
  "$schema": "./schema-agent.json",
  "profession": "researcher",
  "tools": {
    "default": "deny",
    "external_directory": "ask",
    "glob": "allow",
    "grep": "allow",
    "read": "allow",
    "shell": {
      "config": {
        "autoAllowReadonly": true
      },
      "default": "ask",
      "awk *": "allow",
      "cat *": "allow",
      "date *": "allow",
      "diff *": "allow",
      "find *": "allow",
      "git *": "allow",
      "grep *": "allow",
      "head *": "allow",
      "jq *": "allow",
      "ls *": "allow",
      "pwd": "allow",
      "sed *": "allow",
      "sort *": "allow",
      "tail *": "allow",
      "touch *": "allow",
      "tr *": "allow",
      "uniq *": "allow",
      "wc *": "allow",
      "which *": "allow",
      "xargs *": "allow",
      "git push *": "deny",
      "git pull *": "deny"
    },
    "websearch": "allow",
    "context7": "allow",
    "deepwiki": "allow",
    "exa": "allow"
  },
  "skills": {
    "default": "ask"
  },
  "config": {
    "includeMcpJson": true
  }
}