{
  "$schema": "../../../agents-generic/schema-agent.json",
  "profession": "web",
  "tools": {
    "default": "deny",
    "read": "allow",
    "websearch": "allow",
    "context7": "allow",
    "deepwiki": "allow",
    "exa": "allow"
  },
  "skills": {
    "default": "ask"
  },
  "config": {
    "includeMcpJson": true
  }
}